-- test aggregates
/* revert to pre-12 default for stddev(value()) tests */
SET extra_float_digits = 0;
CREATE TEMP TABLE u (
	u unit
);
-- empty
SELECT sum(u) AS null_sum FROM u;
 null_sum 
----------
 
(1 row)

SELECT min(u) AS null_min FROM u;
 null_min 
----------
 
(1 row)

SELECT max(u) AS null_max FROM u;
 null_max 
----------
 
(1 row)

SELECT avg(u) AS null_avg FROM u;
 null_avg 
----------
 
(1 row)

SELECT var_pop(u) AS null_var_pop FROM u;
 null_var_pop 
--------------
             
(1 row)

SELECT var_samp(u) AS null_var_samp FROM u;
 null_var_samp 
---------------
              
(1 row)

SELECT variance(u) AS null_variance FROM u;
 null_variance 
---------------
              
(1 row)

SELECT stddev_pop(u) AS null_stddev_pop FROM u;
 null_stddev_pop 
-----------------
 
(1 row)

SELECT stddev_samp(u) AS null_stddev_samp FROM u;
 null_stddev_samp 
------------------
 
(1 row)

SELECT stddev(u) AS null_stddev FROM u;
 null_stddev 
-------------
 
(1 row)

-- one NULL row
INSERT INTO u VALUES (NULL);
SELECT sum(u) AS null_sum FROM u;
 null_sum 
----------
 
(1 row)

SELECT min(u) AS null_min FROM u;
 null_min 
----------
 
(1 row)

SELECT max(u) AS null_max FROM u;
 null_max 
----------
 
(1 row)

SELECT avg(u) AS null_avg FROM u;
 null_avg 
----------
 
(1 row)

SELECT var_pop(u) AS null_var_pop FROM u;
 null_var_pop 
--------------
             
(1 row)

SELECT var_samp(u) AS null_var_samp FROM u;
 null_var_samp 
---------------
              
(1 row)

SELECT variance(u) AS null_variance FROM u;
 null_variance 
---------------
              
(1 row)

SELECT stddev_pop(u) AS null_stddev_pop FROM u;
 null_stddev_pop 
-----------------
 
(1 row)

SELECT stddev_samp(u) AS null_stddev_samp FROM u;
 null_stddev_samp 
------------------
 
(1 row)

SELECT stddev(u) AS null_stddev FROM u;
 null_stddev 
-------------
 
(1 row)

-- one non-NULL row
DELETE FROM u;
INSERT INTO u VALUES (meter(5));
SELECT sum(u) AS five_meters FROM u;
 five_meters 
-------------
 5 m
(1 row)

SELECT min(u) AS five_meters FROM u;
 five_meters 
-------------
 5 m
(1 row)

SELECT max(u) AS five_meters FROM u;
 five_meters 
-------------
 5 m
(1 row)

SELECT avg(u) AS five_meters FROM u;
 five_meters 
-------------
 5 m
(1 row)

SELECT var_pop(u) AS zero_var_pop FROM u;
 zero_var_pop 
--------------
            0
(1 row)

SELECT var_samp(u) AS zero_var_samp FROM u;
 zero_var_samp 
---------------
             0
(1 row)

SELECT variance(u) AS zero_variance FROM u;
 zero_variance 
---------------
             0
(1 row)

SELECT stddev_pop(u) AS zero_stddev_pop FROM u;
 zero_stddev_pop 
-----------------
 0 m
(1 row)

SELECT stddev_samp(u) AS zero_stddev_samp FROM u;
 zero_stddev_samp 
------------------
 0 m
(1 row)

SELECT stddev(u) AS zero_stddev FROM u;
 zero_stddev 
-------------
 0 m
(1 row)

-- two rows, matching dimensions
DELETE FROM u;
INSERT INTO u VALUES (meter()), (meter(2));
SELECT sum(u) AS three_meters FROM u;
 three_meters 
--------------
 3 m
(1 row)

SELECT min(u) AS one_meter FROM u;
 one_meter 
-----------
 1 m
(1 row)

SELECT max(u) AS two_meters FROM u;
 two_meters 
------------
 2 m
(1 row)

SELECT avg(u) AS oneandhalf_meters FROM u;
 oneandhalf_meters 
-------------------
 1.5 m
(1 row)

SELECT var_pop(u) FROM u;
 var_pop 
---------
    0.25
(1 row)

SELECT var_samp(u) FROM u;
 var_samp 
----------
      0.5
(1 row)

SELECT variance(u) FROM u;
 variance 
----------
      0.5
(1 row)

SELECT stddev_pop(u) FROM u;
 stddev_pop 
------------
 500 mm
(1 row)

SELECT stddev_samp(u) FROM u;
     stddev_samp     
---------------------
 707.106781186548 mm
(1 row)

SELECT stddev(u) FROM u;
       stddev        
---------------------
 707.106781186548 mm
(1 row)

DELETE FROM u;
INSERT INTO u VALUES (kilogram(2)), (kilogram());
SELECT sum(u),         sum(value(u))         FROM u;
 sum  | sum 
------+-----
 3 kg |   3
(1 row)

SELECT min(u),         min(value(u))         FROM u;
 min  | min 
------+-----
 1 kg |   1
(1 row)

SELECT max(u),         max(value(u))         FROM u;
 max  | max 
------+-----
 2 kg |   2
(1 row)

SELECT avg(u),         avg(value(u))         FROM u;
  avg   | avg 
--------+-----
 1.5 kg | 1.5
(1 row)

SELECT var_pop(u),     var_pop(value(u))     FROM u;
 var_pop | var_pop 
---------+---------
    0.25 |    0.25
(1 row)

SELECT var_samp(u),    var_samp(value(u))    FROM u;
 var_samp | var_samp 
----------+----------
      0.5 |      0.5
(1 row)

SELECT variance(u),    variance(value(u))    FROM u;
 variance | variance 
----------+----------
      0.5 |      0.5
(1 row)

SELECT stddev_pop(u),  stddev_pop(value(u))  FROM u;
 stddev_pop | stddev_pop 
------------+------------
 500 g      |        0.5
(1 row)

SELECT stddev_samp(u), stddev_samp(value(u)) FROM u;
    stddev_samp     |    stddev_samp    
--------------------+-------------------
 707.106781186548 g | 0.707106781186548
(1 row)

SELECT stddev(u),      stddev(value(u))      FROM u;
       stddev       |      stddev       
--------------------+-------------------
 707.106781186548 g | 0.707106781186548
(1 row)

-- three rows, one NULL
INSERT INTO u VALUES (NULL);
SELECT sum(u) AS three_kilogram FROM u;
 three_kilogram 
----------------
 3 kg
(1 row)

SELECT min(u) AS one_kilogram FROM u;
 one_kilogram 
--------------
 1 kg
(1 row)

SELECT max(u) AS two_kilogram FROM u;
 two_kilogram 
--------------
 2 kg
(1 row)

SELECT avg(u) AS oneandhalf_kilogram FROM u;
 oneandhalf_kilogram 
---------------------
 1.5 kg
(1 row)

SELECT var_pop(u) FROM u;
 var_pop 
---------
    0.25
(1 row)

SELECT var_samp(u) FROM u;
 var_samp 
----------
      0.5
(1 row)

SELECT variance(u) FROM u;
 variance 
----------
      0.5
(1 row)

SELECT stddev_pop(u) FROM u;
 stddev_pop 
------------
 500 g
(1 row)

SELECT stddev_samp(u) FROM u;
    stddev_samp     
--------------------
 707.106781186548 g
(1 row)

SELECT stddev(u) FROM u;
       stddev       
--------------------
 707.106781186548 g
(1 row)

-- two rows, dimension mismatch
DELETE FROM u;
INSERT INTO u VALUES (ampere()), (kilogram(2));
SELECT sum(u) AS error FROM u;
ERROR:  dimension mismatch in "+" operation: "1 A", "2 kg"
SELECT min(u) AS error FROM u;
ERROR:  dimension mismatch in "unit_least" operation: "1 A", "2 kg"
SELECT max(u) AS error FROM u;
ERROR:  dimension mismatch in "unit_greatest" operation: "1 A", "2 kg"
SELECT avg(u) AS error FROM u;
ERROR:  dimension mismatch in "+" operation: "1 A", "2 kg"
CONTEXT:  SQL function "unit_accum" statement 1
SELECT var_pop(u) AS error FROM u;
ERROR:  dimension mismatch in "+" operation: "1 A", "2 kg"
CONTEXT:  SQL function "unit_accum" statement 1
SELECT var_samp(u) AS error FROM u;
ERROR:  dimension mismatch in "+" operation: "1 A", "2 kg"
CONTEXT:  SQL function "unit_accum" statement 1
SELECT variance(u) AS error FROM u;
ERROR:  dimension mismatch in "+" operation: "1 A", "2 kg"
CONTEXT:  SQL function "unit_accum" statement 1
SELECT stddev_pop(u) AS error FROM u;
ERROR:  dimension mismatch in "+" operation: "1 A", "2 kg"
CONTEXT:  SQL function "unit_accum" statement 1
SELECT stddev_samp(u) AS error FROM u;
ERROR:  dimension mismatch in "+" operation: "1 A", "2 kg"
CONTEXT:  SQL function "unit_accum" statement 1
SELECT stddev(u) AS error FROM u;
ERROR:  dimension mismatch in "+" operation: "1 A", "2 kg"
CONTEXT:  SQL function "unit_accum" statement 1
